{
  "case": "S2-02-real-and-disproved",
  "checks_executed": [
    {
      "command": "sh checks/unit.sh",
      "exit_code": 0,
      "name": "unit",
      "output": "Ran 2 tests in 0.000s\n\nOK"
    },
    {
      "command": "sh checks/field-widths.sh",
      "exit_code": 0,
      "name": "field-widths",
      "output": "field-widths: name field is 12 characters"
    },
    {
      "command": "PYTHONPATH=src /usr/bin/python3 -m signpost.render 'Fork|Ridge' 4",
      "exit_code": 0,
      "name": "render a name holding the separator",
      "output": "Fork|Ridge  |4\ncolumns=3"
    },
    {
      "command": "PYTHONPATH=src /usr/bin/python3 -c 'from signpost.render import WIDTH,row; n=row(\"Fork Ridge\",4).split(\"|\")[0]; print(len(n), WIDTH)'",
      "exit_code": 0,
      "name": "measure the rendered name field",
      "output": "12 12"
    }
  ],
  "findings": [
    {
      "claim": "join() concatenates the fields with a bare separator, so a field holding the separator becomes two fields",
      "evidence_kind": "executed",
      "location": "src/signpost/columns.py:9",
      "scenario": "run PYTHONPATH=src /usr/bin/python3 -m signpost.render 'Fork|Ridge' 4; the row prints `Fork|Ridge  |4` and the count line reads columns=3",
      "severity": "BLOCKER"
    }
  ],
  "notes": "The padder reads as an off-by-one on its own; running it through render.row shows the caller passes WIDTH + 1 and the field measures 12. That one is kept as a note.",
  "notes_kept": [
    {
      "claim": "pad() subtracts one from the width it is given",
      "evidence_kind": "executed",
      "location": "src/signpost/pad.py:6",
      "scenario": "render.row calls pad(name, WIDTH + 1), so the rendered name field measures 12 characters; the measurement above prints `12 12`",
      "severity": "MAJOR"
    }
  ],
  "role": "reviewer",
  "seeded_answer": 1,
  "session_id": "sess-review-1",
  "verdict": "rejected"
}
